{
  "format": "axiom-platform-release-decision-v1", "formatVersion": 1, "authority": "G0_WIRING_ONLY", "cadence": "RELEASE", "decision": "BLOCKED_AUTHORITY", "failedSubject": "web", "blockingReasons": ["REQUIRED_REALITY_MISSING:web:PHYSICAL"],
  "identity": { "sourceCommit": "aaaaaaaaaaaaaaaaaaaaaaaaaaaaaaaaaaaaaaaa", "schemaSha256": "bbbbbbbbbbbbbbbbbbbbbbbbbbbbbbbbbbbbbbbbbbbbbbbbbbbbbbbbbbbbbbbb", "corpusSha256": "cccccccccccccccccccccccccccccccccccccccccccccccccccccccccccccccc", "runnerVersion": "0.1.0", "runtimeVersion": "0.1.0", "repeat": 1, "seed": 17 },
  "pgStatuses": [{ "group": "PG-06", "status": "BLOCKED_AUTHORITY" }], "evidenceSubjects": ["web"]
}
